<?xml version="1.0" encoding="UTF-8"?>

<ruleset name="Third Test RuleSet"
         xmlns="https://phpmd.org/xml/ruleset/1.0.0"
         xmlns:xsi="http://www.w3.org/2001/XMLSchema-instance"
         xsi:schemaLocation="https://phpmd.org/xml/ruleset/1.0.0 http://phpmd.org/xml/ruleset_xml_schema_1.0.0.xsd"
         xsi:noNamespaceSchemaLocation="https://phpmd.org/xml/ruleset_xml_schema_1.0.0.xsd">

    <description>First description...</description>

    <rule ref="rulesets/set1.xml/RuleTwoInFirstRuleSet">
        <description> description 42 </description>
        <priority>4</priority>
        <properties>
            <property name="foo" value="42" />
        </properties>
        <example><![CDATA[foreach ($foo as $bar) { echo $bar; }]]></example>
    </rule>
</ruleset>